	oferta_od	pokaz_oferty_z_numerem_vin	marka_pojazdu	model_pojazdu	rok_produkcji	przebieg	pojemnosc_skokowa	rodzaj_paliwa	moc	skrzynia_biegow	naped	typ_nadwozia	liczba_drzwi	liczba_miejsc	kolor	mozliwosc_finansowania	kraj_pochodzenia	bezwypadkowy	serwisowany_w_aso	stan	oblicz	url	cena	description	wyposazenie	dealer	loc	tytul
0	Firma	Tak	Volkswagen	Beetle	2014.0	167000.0	15983.0	Diesel	105.0	Manualna	Na przednie kola	Coupe	3.0	4.0	Bialy	Tak	Niemcy	Tak	Tak	Uzywane	VIN	https://www.otomoto.pl/osobowe/oferta/volkswagen-beetle-super-stan-navi-ID6FW0Oy.html	47900.0	SPRZEDAMVW BEETLEAUTO WBDBSTANIE TECHNICZNYM ORAZ WIZUALNYM !!! * SILNIK, ZAWIESZENIE, SKRZYNIA BIEGOW ORAZ WSZYSTKIE PODZESPOLY DZIALAJAWZOROWO!!! * WNETRZE AUTA CZYSTE, BEZ PLAM ORAZ PRZETARC !!! * LAKIER WIDEALNYMSTANIE !!!Mozliwa zamiana albo kredytowanie, zapraszamy serdecznie Lebork-Mosty ul. Dluga 28!!!- Dodatkowe informacje: liczba miejsc: 4, kraj pochodzenia: NiemcyNumer oferty: AKL17SC94	['System nawigacji satelitarnej', 'Klimatyzacja automatyczna', 'Podgrzewany fotel kierowcy', 'Podgrzewany fotel pasazera', 'Podlokietniki - przod', 'Kierownica ze sterowaniem radia', 'Kierownica wielofunkcyjna', 'Czujnik deszczu', 'Elektryczne szyby przednie', 'Przyciemniane tylne szyby', 'Tempomat', 'Kontrola odleglosci z przodu (przy parkowaniu)', 'Kontrola odleglosci z tylu (przy parkowaniu)', 'Lusterka boczne ustawiane elektrycznie', 'Podgrzewane lusterka boczne', 'Kontrola trakcji', 'Wspomaganie kierownicy', 'ABS', 'ESP', 'Poduszka powietrzna kierowcy', 'Poduszka powietrzna pasazera', 'Poduszka powietrzna centralna', 'Boczne poduszki powietrzne - przod', 'Boczne poduszki powietrzne - tyl', 'Isofix (punkty mocowania fotelika dzieciecego)']	['Salon samochodow uzywanych AUTO BIGUS', 'Sprzedajacy profesjonalny', 'Bardzo sprawnie odpowiada', 'Sprzedajacy na OTOMOTO od 2013']	Majkowskiego 10, Lebork, Polska - 84-300 Lebork, leborski, Pomorskie (Polska)	Volkswagen Beetle
1	Prywatne	Tak	Volkswagen	Beetle	2012.0	200000.0	13903.0	Benzyna	160.0	Manualna	Na przednie kola	Kompakt	3.0	4.0	Bialy	unknown	Niemcy	Tak	unknown	Uzywane	VIN	https://www.otomoto.pl/osobowe/oferta/volkswagen-beetle-vw-beetle-1-4-tsi-sport-r-stan-super-piekne-wykonczenie-wnetrza-ID6FNQw3.html	40999.0	PIEKNY VW BEETLE JEDYNY W SWOIM RODZAJU, JEDYNE TAK WYKONCZONE WNETRZE W STANIE IDEALNYM, SERVIS OLEJOWO FILTROWY LIPIEC 2023, PRZEGLAD DO 07.09.24 CZYLI CALY ROK SPOKOJNEJ JAZDY:) WIECEJ INFORMACJI POD NUMEREMWyswietl numer, MOZNA PISAC SMS UBEZPIECZNIE OC OD 02.10.2023.DO 02.10.2024	['Radio', 'Gniazdo USB', 'System naglosnienia', 'Ekran dotykowy', 'Klimatyzacja manualna', 'Szyberdach szklany - przesuwny i uchylny elektrycz', 'Tapicerka skorzana', 'Podgrzewany fotel kierowcy', 'Podgrzewany fotel pasazera', 'Fotele przednie wentylowane', 'Sportowe fotele - przod', 'Podlokietniki - przod', 'Kierownica skorzana', 'Kierownica ze sterowaniem radia', 'Kierownica wielofunkcyjna', 'Dzwignia zmiany biegow wykonczona skora', 'Czujnik deszczu', 'Elektryczne szyby przednie', 'Elektryczne szyby tylne', 'Przyciemniane tylne szyby', 'Tempomat', 'Lampy bi-ksenonowe', 'Podgrzewane lusterka boczne', 'Kontrola trakcji', 'Lampy doswietlajace zakret', 'Swiatla do jazdy dziennej diodowe LED', 'Lampy przeciwmgielne', 'Felgi aluminiowe 18', 'ABS', 'ESP', 'System wspomagania hamowania', 'Poduszka powietrzna kierowcy', 'Poduszka powietrzna pasazera', 'Kurtyny powietrzne - przod', 'Boczne poduszki powietrzne - przod', 'Isofix (punkty mocowania fotelika dzieciecego)']	['Rafal', 'Osoba prywatna', 'Sprzedajacy na OTOMOTO od 2015']	Wojkowice, bedzinski, Slaskie	Volkswagen Beetle The 1.4 TSI Fender Edition
2	Firma	Tak	Volkswagen	Beetle	2012.0	65880.0	11973.0	Benzyna	105.0	Manualna	Na przednie kola	Kompakt	3.0	4.0	Czarny	Tak	Polska	unknown	Tak	Uzywane	VIN	https://www.otomoto.pl/osobowe/oferta/volkswagen-beetle-1-2-tsi-salon-polska-serwis-aso-navi-klimatronic-tempomat-ID6FTWrg.html	35000.0	"AAA AUTO - najwiekszy dealer samochodow uzywanych w Europie Srodkowej! Jestesmy wlascicielem wszystkich aut znajdujacych sie w naszej ofercie!NASZE ATUTY:1. Jestesmy wlascicielami sprzedawanych pojazdow. Samochody oferowane w AAA AUTO wyrozniaja sie jakoscia i mozna je kupic w rozsadnej cenie.2. Ponad 2 miliony zadowolonych klientow w blisko 30-letniej historii firmy.3. Specjalizujemy sie w pojazdach krajowych - az 80% naszych aut to pojazdy, ktore byly pierwotnie zarejestrowane w Polsce.4. W AAA AUTO przeprowadzamy kontrole stanu licznika oraz liczby faktycznie przejechanych kilometrow.5. Zapewniamy dozywotnia gwarancje legalnego pochodzenia pojazdu oraz Carlife - ubezpieczenie gwarancyjne na stan mechaniczny pojazdu do 36 miesiecy.6. Umozliwiamy zawarcie umowy kredytu 7 dni w tygodniu* ( w tygodniu z niedziela handlowa), wplata wlasna pod 0%.7. Oferujemy OC i AC tansze nawet do 30%. Wszystkie formalnosci mozna zalatwic w naszym salonie.8. Placimy nawet do 20% wiecej za Twoj samochod, jesli nowy kupisz u nas.9. Oferujemy Program ""7 dni na wymiane auta bez podania powodu""10. Umozliwiamy skorzystanie z dlugiej jazdy probnej.11. Kredyt dostepny na kazde auto.12. Przewieziemy auto do najblizszego salonu od Twojego zamieszkania lub bezposrednio pod dom. * Reprezentatywny przyklad kalkulacji kredytowej: Samochod Ford Focus rocznik 2015, cena samochodu 55000 zl, wklad wlasny 30% (16500 zl). Calkowita kwota kredytu konsumenckiego 39285,71 zl, 36 miesiecznych rat rownych po 1199,60 zl. Okres obowiazywania umowy: 36 miesiecy. Oprocentowanie stale w skali roku: 6,25%. Rzeczywista roczna stopa oprocentowania: 7,89%. Calkowita kwota do zaplaty: 43185,6 zl. Calkowity koszt kredytu: 4685,60 zl (w tym prowizja za udzielenie kredytu 785,71 zl, odsetki 3899,89 zl). Przyznanie i warunki kredytu zaleza od pozytywnej oceny zdolnosci i wiarygodnosci kredytowej.AAA AUTO prowadzi dzialalnosc posrednictwa dla kredytodawcow: Santander Consumer Bank S.A., BNP Paribas Bank Polska S.A., AS Inbank SA, Cofidis S.A., mLeasing, IdeaLeasing.Niniejsze ogloszenie nie stanowi oferty ani zapewnienia, w szczegolnosci rozumieniu art. 66 SS 1 i art. 556 indeks 1 Kodeksu cywilnego. Auocentrum AAA Auto zastrzega sobie prawo do doprecyzowania oraz korekt omylek."	['Radio', 'System nawigacji satelitarnej', 'Klimatyzacja automatyczna', 'Kierownica skorzana', 'Kierownica ze sterowaniem radia', 'Kierownica wielofunkcyjna', 'Elektryczne szyby przednie', 'Tempomat', 'Kontrola odleglosci z przodu (przy parkowaniu)', 'Kontrola odleglosci z tylu (przy parkowaniu)', 'Lusterka boczne ustawiane elektrycznie', 'Kontrola trakcji', 'Elektroniczna kontrola cisnienia w oponach', 'Wspomaganie kierownicy', 'ESP', 'Poduszka powietrzna kierowcy', 'Poduszka powietrzna pasazera', 'Isofix (punkty mocowania fotelika dzieciecego)']	['AAA AUTO - ponad 12 000 sprawdzonych aut w ofercie! Kredyt i Leasing na miare.', 'Sprzedajacy profesjonalny', 'Bardzo sprawnie odpowiada', 'Sprzedajacy na OTOMOTO od 2022']	aleja Grunwaldzka 256 - 80-314 Gdansk, Pomorskie (Polska)	Volkswagen Beetle
3	Prywatne	Tak	Volkswagen	Beetle	2015.0	160000.0	24803.0	Benzyna	170.0	Automatyczna	Na przednie kola	Coupe	2.0	5.0	Zolty	unknown	unknown	unknown	unknown	Uzywane	VIN	https://www.otomoto.pl/osobowe/oferta/volkswagen-beetle-ID6FR218.html	44900.0	1.8 Turbo (automatic, sport mode). Bardzo dobry stan. Oryginalny przebieg. Dopiero po serwisie. Przeglad techniczny do 04.2024. Samochod znajduje sie na Litwie, istnieje mozliwosc dostarczenia do Suwalki lub na terenie calej Polski.Komunikacja przez Viber, WhatsApp, Telegram.+ 37O 683 895961.8 Turbo, avtomat so sport rezhimom. Otlichnoe sostoianie. Original'nyi probeg. Tol'ko posle obsluzhivaniia. Tekhosmotr do 04.2024. Mashina v Litve, vozmozhna dostavka v Suvalki ili po vsei Pol'she.Sviaz' cherez Viber, WhatsApp, Telegram.	['Interfejs Bluetooth', 'Radio', 'Zestaw glosnomowiacy', 'Gniazdo USB', 'Klimatyzacja automatyczna', 'Podgrzewany fotel kierowcy', 'Podgrzewany fotel pasazera', 'Kierownica skorzana', 'Keyless Go', 'Elektryczne szyby przednie', 'Tempomat', 'Lusterka boczne ustawiane elektrycznie', 'Podgrzewane lusterka boczne', 'Kontrola trakcji', 'Swiatla do jazdy dziennej', 'Elektroniczna kontrola cisnienia w oponach', 'Wspomaganie kierownicy', 'ABS', 'ESP', 'Elektroniczny system rozdzialu sily hamowania', 'System wspomagania hamowania', 'Poduszka powietrzna kierowcy', 'Poduszka powietrzna pasazera', 'Kurtyny powietrzne - przod', 'Boczna poduszka powietrzna kierowcy', 'Boczne poduszki powietrzne - przod', 'Isofix (punkty mocowania fotelika dzieciecego)']	['Vitaliy', 'Osoba prywatna', 'Sprzedajacy na OTOMOTO od 2023']	Suwalki, Podlaskie	Volkswagen Beetle 2.5
4	Prywatne	Tak	Volkswagen	Beetle	2011.0	166642.0	19843.0	Benzyna	200.0	Automatyczna	unknown	Coupe	3.0	4.0	Czarny	unknown	unknown	unknown	unknown	Uzywane	VIN	https://www.otomoto.pl/osobowe/oferta/volkswagen-beetle-ID6FGcTP.html	43200.0	Witam,  sprzedam VW Beetle z 2011 roku. samochod w bardzo dobrym stanie, w bogatej wersji wyposazenia. Zadbany. Zapraszam do kontaktu- chetnie udziele wiecej informacji. Do obejrzenia w Poznaniu.	[]	['Dawid', 'Osoba prywatna', 'Sprzedajacy na OTOMOTO od 2014']	Poznan, Jezyce	Volkswagen Beetle The 2.0 TSI DSG Sport
